{
  "$schema": "https://json-schema.org/draft/2020-12/schema",
  "$id": "https://shiplight.dev/schemas/quality/quality-observations.schema.json",
  "title": "Quality Observations",
  "type": "object",
  "additionalProperties": false,
  "required": [
    "schema_version",
    "revision",
    "observed_at",
    "observations"
  ],
  "properties": {
    "schema_version": {
      "const": 1
    },
    "revision": {
      "type": "object",
      "additionalProperties": false,
      "required": [
        "commit"
      ],
      "properties": {
        "commit": {
          "type": "string",
          "minLength": 1
        },
        "branch": {
          "type": "string",
          "minLength": 1
        },
        "dirty": {
          "type": "boolean"
        }
      }
    },
    "run": {
      "type": "object",
      "additionalProperties": false,
      "required": [
        "id"
      ],
      "properties": {
        "id": {
          "type": "string",
          "minLength": 1
        },
        "url": {
          "type": "string",
          "minLength": 1
        }
      }
    },
    "observed_at": {
      "type": "string",
      "format": "date-time"
    },
    "observations": {
      "type": "array",
      "minItems": 1,
      "uniqueItems": true,
      "x-unique-by": [
        "path",
        "test_case"
      ],
      "items": {
        "type": "object",
        "additionalProperties": false,
        "required": [
          "path",
          "status"
        ],
        "properties": {
          "path": {
            "type": "string",
            "minLength": 1
          },
          "test_case": {
            "type": "string",
            "minLength": 1
          },
          "status": {
            "enum": [
              "pass",
              "fail",
              "error",
              "skipped"
            ]
          },
          "observed_at": {
            "type": "string",
            "format": "date-time"
          },
          "note": {
            "type": "string",
            "minLength": 1
          },
          "artifacts": {
            "type": "array",
            "minItems": 1,
            "items": {
              "type": "object",
              "additionalProperties": false,
              "required": [
                "ref"
              ],
              "properties": {
                "ref": {
                  "type": "string",
                  "minLength": 1
                },
                "label": {
                  "type": "string",
                  "minLength": 1
                }
              }
            }
          }
        }
      }
    }
  }
}
