{
  "schema_version": 1,
  "revision": {
    "commit": "<git-sha>",
    "branch": "<branch>"
  },
  "run": {
    "id": "<run-id>",
    "url": "<run-url>"
  },
  "observed_at": "2026-07-26T18:00:00Z",
  "observations": [
    {
      "path": ".github/workflows/<workflow>.yml",
      "test_case": "<step-or-check-name>",
      "status": "pass",
      "note": "<optional diagnostic note>"
    }
  ]
}
